title,score,id,url,comms_num,created,body
I panicked and sold,25632,lacdwx,https://www.reddit.com/r/wallstreetbets/comments/lacdwx/i_panicked_and_sold/,1072,2021-02-01 22:55:48,"Seeing all the red on $GME today, I panicked.

I was scared I would miss another dip, so I sold some of my green colored lines to buy $6k more $GME.

I locked in my profits from other stocks AND lowered my average price per share on $GME. I'm literally Buffet.

It's called buy low sell high retards. No one is selling at this point.

Selling now is literally the same as walking into a restaurant and paying for a billionaire's lunch. Just venmo a hedge fund directly. You might as well go to one of their 8 homes, strip naked, and let them use you as a footrest. Let them call you good boy while you roll over and lick their shoes. For anyone selling now (which thankfully almost no one is), it's humiliating.

Buying now off the short ladder is buying another shorted stock which they HAVE to buy back from you at WHATEVER price you want.

It's the best feeling in the world. Empowering. Intoxicating.

I'm touching my pp right now.

Buy up their shorts."
A Note to the Hedgie Lurkers,25543,l77h3i,https://www.reddit.com/r/wallstreetbets/comments/l77h3i/a_note_to_the_hedgie_lurkers/,1350,2021-01-28 23:16:26,"I AIN'T HEAR NO BELL

You do realize you're fucking with the most irrational collection of individuals in the entire market, right? We're used to red days. Most of us are colorblind and can't tell the difference anyways. Some literally get off on loss, others are completely desensitized to it. Many of us have been in this shit since $10-$40. Conviction is way too strong to sell at a measly $130. That ladder was pretty sick today, ngl, you might've grabbed some paper handers/newblood, but do you think we're fucking BLIND? WE CAN SEE THE TRADING VOLUME. Even though many of us can't buy today, good luck finding enough sellers. Once the floodgates are open, WE LIKE THE STOCK, so people will buy the hell out of it. Hedgies should double down again, I really want that $5k per share. Holding till the bitter end."
Curious why Papa Elon is shilling $GME? It’s because Melvin Capital shorted $TSLA for years and bragged about it.,25509,l5s9ss,https://www.reddit.com/r/wallstreetbets/comments/l5s9ss/curious_why_papa_elon_is_shilling_gme_its_because/,1668,2021-01-27 03:47:41,"Elon has battled shorts for almost a decade. We all remember when he complained that shorting should be illegal, and when he released “short shorts” when he finally defeated them. 

But guess who used to brag about shorting Tesla? Gabe 🌈🐻 Plotkin. 

From [Bloomberg:](https://www.bloomberg.com./news/articles/2019-07-19/cohen-cub-gabriel-plotkin-sees-fund-surge-about-44-this-year)

Plotkin described Melvin as “a very human-intensive place. We have a lot of analysts, we require a lot out of them.” The team has modeled more than 500 companies in “significant detail,” while a data science group reads into trends.
He added that the firm has an “intense focus” on the short side, with about 70% of profits in Melvin’s first year coming from bearish bets. Plotkin expressed skepticism about mall real estate investment trusts, as well as electric-car maker Tesla Inc.

$GME to the 🌚, then profits back to a safe store of value: $TSLA.

UPDATE: [better source](https://fintel.io/so/us/tsla/melvin-capital-management-lp) showing Melvin Capital’s puts on TSLA from 2016 through 2020

UPDATE 2: stop giving me silver awards your cheap bastards. Platinum or GTFU.

UPDATE 3: [positions or ban. ](https://www.reddit.com/r/wallstreetbets/comments/l5s9ss/curious_why_papa_elon_is_shilling_gme_its_because/gkwauak/?utm_source=share&utm_medium=ios_app&utm_name=iossmf&context=3). You can check out my post history for all my plays to see how I over 10X my $500K from a year ago.

Update 4: hi r/all, for those of you wondering what in the hell is going on with Gamestock, [this comment ](https://www.reddit.com/r/wallstreetbets/comments/l5s9ss/curious_why_papa_elon_is_shilling_gme_its_because/gkx1nd7/?utm_source=share&utm_medium=ios_app&utm_name=iossmf&context=3) sums it up nicely."
Scared Money Don't Make Money,25475,faxbw0,https://i.redd.it/bxn2mf4bzoj41.jpg,801,2020-02-28 19:32:33,
Red is just a color. Be patient. Stay strong 💎 ✋,25439,lars5l,https://i.redd.it/pjmkigm881f61.gif,311,2021-02-02 12:21:10,
CITADEL PAYS SEC $22.6 MIL TO SETTLE CHARGES OF MISLEADING CUSTOMERS (already back in 2017). Nothing has changed! And the SEC is never going to do anything that will harm Citadel.,25430,lc5mff,https://i.redd.it/1l5jn8i9kdf61.jpg,716,2021-02-04 05:49:39,
Still HOLDING! WHO IS WITH ME???,25422,lc12ss,https://i.redd.it/pq9oifapgcf61.jpg,1811,2021-02-04 02:07:54,
This 🌈 🐻 is still waiting,25405,gg60bp,https://i.redd.it/rcf6kyd85nx41.jpg,596,2020-05-09 05:19:57,
The current market explained,25390,ika75g,https://v.redd.it/nth9u829lfk51,562,2020-09-01 04:32:19,
WE HAVE ALMOST WON OUR FIRST MAJOR BATTLE 💎🙌💎🙌💎🙌💎🙌,25384,l82qwt,https://www.reddit.com/r/wallstreetbets/comments/l82qwt/we_have_almost_won_our_first_major_battle/,1687,2021-01-29 23:09:52,"AS MANY OF YOU KNOW THERE ARE CONTRACTS THAT EXPIRE TODAY AT **$115. THE HEDGE FUNDS WILL DO EVERYTHING THEY CAN TO TRY TO DRIVE THE STOCK DOWN TO THAT PRICE TO SAVE THEIR ASSES.**

How are they going to do that because some of you retards still dont know? They are going to trade the stock in low volumes at rapid speeds to **MAKE IT SEEM LIKE THE STOCK IS LOSING VALUE**. BUT IT IS NOT LOSING VALUE. The volumes that the hedgefunds are trading at are a .000X% of gamestops overall volume. They want you to be scared and sell your stock so that they will win. DO NOT FUCKING SELL DO NOT LET THE HEDGES WIN. HOLD WE WILL MAKE HISTORY. HOLD AND WE WILL WIN. DO NOT SELL YOUR FUCKING SHARES. AND BUY THE DIP.

(THIS IS NOT FINANCIAL ADVICE, DO YOUR OWN RESEARCH, I JUST LIKE THE STOCK)

Edit - for those of you asking what you should do: don’t spend money you can’t afford to lose."
The last sub standing,25340,himde3,https://v.redd.it/ygrfxgg3i1851,1217,2020-06-30 16:25:24,
"It's happening in Australia now. STAKE is pulling a Robinhood and not allowing buys in $GME, $AMC & $NOK!!",25334,larmtn,https://hellostake.com/au/stake-updates/understanding-trading-suspensions/,1367,2021-02-02 12:09:56,
"Volkswagen short squeeze from 2008, the red is [YOU] right now! 💎👐🚀💎👐 🚀",25294,l75z1d,https://i.redd.it/k1p7llq5j4e61.png,919,2021-01-28 22:23:17,
I Run A Public Company. Short Sellers Attacked Us Years Ago. Here’s Why I Stand With Reddit’s WallStreetBets.,25278,lc6amt,https://rick-axon.medium.com/i-run-a-public-company-5b6347fc0b1f,559,2021-02-04 06:23:24,
Pzifer vaccine news hitting the market,25239,jr5ym1,https://v.redd.it/4gysgbsw0ay51,746,2020-11-09 23:46:06,
Still counts as gainz right?,25205,kb3gvk,https://v.redd.it/ew072n2dfk461,389,2020-12-11 17:10:15,
"Stanley from The Office is active in WSB. (Yes, it’s actually him)",25204,lc0pts,https://i.redd.it/veytnyhwdcf61.jpg,368,2021-02-04 01:52:12,
PAY ATTENTION CONCERNING FAKE NEWS,25158,la0buk,https://www.reddit.com/r/wallstreetbets/comments/la0buk/pay_attention_concerning_fake_news/,708,2021-02-01 13:38:22,"You might have noticed this weekend that the hedge funds tried to push silver (a great commodity btw) via their shills on the media (expect more this morning on CNBC). 

Anyone who puts his money in SLV is literally giving money to Citadel as they are the 4th largest institutional holder ([proof](https://twitter.com/EricBalchunas/status/1355984987770728448?s=09)).This is just a pure DISTRACTION at this time aimed at diverting attention from GME.

The **FUD (Fear Uncertainty Doubt) campaigns have started**. They're trying to distribute lies to the public to reduce the hype and divert attention around GME.

So stay woke and keep your cool before we leave the solar system and the Milky Way 🚀🚀🚀🚀💎💎💎

(This is not financial advice. I'm not a financial advisor 🦍)"
Some retard walked into my clinic today needing a tumor removed from his leg,25094,ja47rq,https://www.reddit.com/r/wallstreetbets/comments/ja47rq/some_retard_walked_into_my_clinic_today_needing_a/,512,2020-10-13 05:49:06,"Me, professional surgeon at my clinic for just another routine day of patient assessments.

Guy comes in saying he has a tumor on his leg that needs removed, easy enough.

While I’m literally looking at the tumor on this guys leg he blurts out “got any stonks?” like it’s the only thing he’s talked about in years.

Complains he has TSLA 500 calls expiring early next year, I tell him I’m balls deep in $SPCE and that I was the guy who was on GME before it was cool. 

I suggest he gets treated for his undiagnosed autism. 

Retard rage quits the assessment and walks out of clinic due to my comment.

I didn’t get to tell him he has testicular cancer which is causing a tumor in his leg; He likely won’t live to see those calls expire."
"CONFIRMED: Author behind Oscar-winning ""The Social Network"" proposes future WSB book & movie; rights are promptly claimed by FUCKING MGM",25101,l9wlrt,https://www.reddit.com/r/wallstreetbets/comments/l9wlrt/confirmed_author_behind_oscarwinning_the_social/,953,2021-02-01 09:18:05,"This is INSANE news, guys. Ben Mezrich, one of the most entertaining and decorated authors of the last decade has officially submitted a book proposal for the story of WSB doing what WSB does best: Fucking shit up, and taking $GME to fucking Mars and beyond! It's already been claimed by monster media conglomerate MGM, meaning this will be a BIG-TIME hollywood movie & book!

If this isn't an adrenaline shot of motivation to give Ben one hell of a story to tell, I don't know what is!

DIAMOND HANDS MOTHERFUCKERS, WE'RE OFFICIALLY IN SCENE 1 OF A MOVIE RIGHT NOW.

TIME TO BLOW THE TOP OFF OF THIS SHIT. TELL YOUR FRIENDS, BUY EVERY DIP, $69,420 SELL ORDERS ONLY. (not financial advice)

🚀💎🙌 💎🙌 💎🙌 💎🙌 🚀

[Ben's announcement tweet](https://twitter.com/benmezrich/status/1356042246580273161?s=20)

[Full story](https://deadline.com/2021/01/mgm-ben-mezrichs-the-antisocial-network-wall-street-1234684378/)"
City AM’s headline is a beaut.,25073,l5pkne,https://i.redd.it/lon30qve7rd61.jpg,968,2021-01-27 01:34:17,
This has to be the top,24960,f5imdv,https://i.imgur.com/V8zRG5C.jpg,726,2020-02-18 03:19:12,
My grandfather told me I would fail and to call him in a year. (7 months later),24900,l9culr,https://i.redd.it/4w5mwkjncoe61.jpg,1123,2021-01-31 17:02:26,
Bought a Billboard AD in San Jose! Running Next Week,24852,l8ry4o,https://www.reddit.com/gallery/l8ry4o,554,2021-01-30 21:22:48,
To the newcomers,24823,esvves,https://i.redd.it/sf2xzlag4kc41.gif,501,2020-01-23 19:57:14,
I made this one... with my tears.,24747,fjp1io,https://v.redd.it/orxxnbpsn2n41,327,2020-03-16 21:48:01,
"Spotted in Auckland, New Zealand. #diamondhands.",24743,lbnpm9,https://i.redd.it/25kq4yhdn9f61.jpg,254,2021-02-03 16:40:05,
"If GME hits 500 dollars I'm going to donate a grand from my small 14 shares to Involve MN, an organization to help homeless people in the Minneapolis area. I would encourage others to do good as well with a portion of their earnings.",24694,l685hg,https://www.involvemn.org/,417,2021-01-27 19:26:16,
"The GME Thread, Part 2, for January 27, 2021",24569,l65p3u,https://www.reddit.com/r/wallstreetbets/comments/l65p3u/the_gme_thread_part_2_for_january_27_2021/,92997,2021-01-27 17:33:41,"wonder how many threads we'll hit today

[WSB Stats](http://wsb.gold/public/dashboard/e65fcfcb-70a4-4d86-b7fb-888057c67881) / [Rules](https://www.reddit.com/r/wallstreetbets/about/rules)"
It's not a loss unless we sell! Netherlands is holding the line 🇳🇱,24547,lasr1z,https://i.redd.it/blw5t350l1f61.png,1087,2021-02-02 13:33:10,
"How it feels to be here while trading all your money. Thank you, everybody, for a phenomenal year.",24547,kitb18,https://v.redd.it/oydd9lwfxx661,669,2020-12-23 16:43:18,
There cant be a trade deficit if there is no trade.,24489,89ov7h,https://i.redd.it/sag7tc5duvp01.jpg,1459,2018-04-04 16:07:34,
I'm the guy who lost 250k on Luckin Coffee last year and ended up on yahoo finance and marketwatch. I'm still here and more retarded than ever,24477,l7rr53,https://www.reddit.com/r/wallstreetbets/comments/l7rr53/im_the_guy_who_lost_250k_on_luckin_coffee_last/,503,2021-01-29 15:50:57,"Original Post https://www.reddit.com/r/wallstreetbets/comments/gveon3/ive_lost_240k_on_luckin_coffee_all_my_life/

Different user as StopFapForever was not working IRL. Plus my flair now checks out.

Listen fuckin idiots. I've holded LKNCY since it went from 48 to 2 at - 97%.

I never fuckin sold and I'm still in balls deep. Luckly is back to 12-13 and slowly recovering.

If I holded all my net worth for so long, YOU CAN FUCKIN HOLD A - 40% FOR A DAY OR EVEN A WEEK.

Don't be pussy paper hand small dick. I'm again balls deep in BB since last monday (only 30k which is what I have). I'll never fuckin sell.

Today I've putted 5k on GME just cause I fuckin love you and I'm with you all along. Just for the cause. I prefer to lose 5k on GME than spending them in videogames or shit like that.

I'm in Europe and cant sleep and fuck my GF. Luckly her boyfriend is helping her out. I've been awake all night to check twitter, premarket, aoc steam on twitch.

I'm with you all the way long. Ride or die.

'' There will be a day when all of us will sell and make tendies into valhalla Elon Mars city. But NOT TODAY. Today we fuckin stand together and fight for whats right''

Fuck you Citron. Fuck you Melvin. Fuck you Etoro. Fuck you Hedge fund.

We are coming from all over the world to fuck you.

Keeo HOLD and GME BB TO THE FUCKIN GALAXY AND BEYOND 🚀🚀🚀🚀"
When my co-worker sees my robinhood app and asks for investment advice,24466,k7fnni,https://i.redd.it/3t9c7bwbnf361.jpg,274,2020-12-06 00:00:46,
Hold the line,24445,l7p8pk,https://v.redd.it/n1duv2s4z8e61,285,2021-01-29 13:23:18,
Portland OR Apes Strong! Also Apes no read/spell good.,24443,lboeia,https://i.redd.it/jor8lwdmt9f61.jpg,318,2021-02-03 17:14:57,
SHITRON JUST REMEMEBERED THAT THE INAUGURATION IS TAKING PLACE!,24409,l1ca4x,https://i.redd.it/wvvbo059iic61.jpg,1266,2021-01-20 19:14:55,
Turned 800$ in GME into 60k as of now. This is life changing money but you bet your ass I’m still holding 💎🙌 HOLD! 🦍🚀,24345,l8uql6,https://i.redd.it/zfec6e3c3je61.jpg,1199,2021-01-30 23:21:19,
Ladies and Gentlemen. We Got him.,24276,fx5zwf,https://www.reddit.com/r/wallstreetbets/comments/fx5zwf/ladies_and_gentlemen_we_got_him/,2279,2020-04-08 16:56:51,"Good evening.  Tonight, I can report to the American people and to the world that the United States has conducted an operation that ***** Jartek and a terrorist who’s responsible for the ******** of thousands of innocent members.

It was nearly 10 years ago that a bright September day was darkened by the worst attack on the American people in our history. 

Tonight, we give thanks to the countless intelligence and counterterrorism professionals who’ve worked tirelessly to achieve this outcome.  The Subreddit and its people do not see their work, nor know their names.  But tonight, they feel the satisfaction of their work and the result of their pursuit of justice.

We give thanks for the men who carried out this operation, for they exemplify the professionalism, patriotism, and unparalleled courage of those who serve our community.  And they are part of a generation that has borne the heaviest share of the burden since that April day.

Thank you and Welcome Back.

P.S.  All Bans have been cleared from the sub. All of them."
"Down 400k, I WILL HOLD! 💎🙌",24244,lb2vle,https://i.redd.it/iom0gb7bz3f61.jpg,767,2021-02-02 21:36:50,
GME super awesome megathread weds 2/3,24200,lbm3vr,https://www.reddit.com/r/wallstreetbets/comments/lbm3vr/gme_super_awesome_megathread_weds_23/,62404,2021-02-03 15:03:58,Edit:  Stop DMing me to pump your shitcoin or penny stocks.  Seriously.
"Forgot I had this account, i shit myself. So retarded I 💎✋ed without even knowing.",24197,l964i6,https://www.reddit.com/gallery/l964i6,825,2021-01-31 09:04:15,
I love 2018,24138,9duyk6,https://i.redd.it/4nmj043pvtk11.png,823,2018-09-07 18:38:57,
Elon carrying his second child,24131,gtf94r,https://i.redd.it/0486d7y5yw151.jpg,999,2020-05-30 18:34:41,
WE MUST RALLY AGAINST THE SUITS 💎💎💎🚀🚀🚀,24123,l76y13,https://i.redd.it/k0ndkhidp4e61.jpg,360,2021-01-28 22:58:07,
What we all fear tomorrow,24108,kcga9j,https://v.redd.it/ep558f2g40561,741,2020-12-13 21:57:00,
We are tired of Market Manipulators and corrupted media. This is time to act,24092,l5teyc,https://www.reddit.com/r/wallstreetbets/comments/l5teyc/we_are_tired_of_market_manipulators_and_corrupted/,1899,2021-01-27 04:48:56,"This is not about $GME anymore, this is about setting terms straight:

**Retail does not want to be manipulated anymore.**

For decades Wall Street was manipulating securities, getting away with it, and blaming it on others. Through the media, bullshit target prices, naked short selling, or other forms of manipulation mentioned [here](https://en.wikipedia.org/wiki/Market_manipulation) (Kenneth, [this one](https://www.ft.com/content/16cee174-3b7f-11ea-b232-000f4477fbca)'s for you). Citadel and many other MMs - don't misinterpret with Market Makers, we're talking about Market Manipulators here - got away with their dirty tactics to make shitload of money and screw people over. They finally got caught in their own game and tried everything to turn it around, but Shitron didn't work, the media didn't work, more aggressive selling didn't work. Now they're calling through some random crooks for regulations.

**BULLSHIT.** Regulation for what? Exchange of ideas? Our own Due Diligence? Winning against you in your own game? Yeah, in most cases your buddies at the SEC would gladly do so if you tell them anyway. This time though? People finally came to the realisation what the fuck you guys are doing over there. It was known by many since 2008 but people forgot quickly, and now is the time to remind them that you are no one else's friend but your crooked buddies.

I never thought I'd say this, but this community showed more leadership and guidance than any other media network. Providing knowledge, research, answers, many of you proven that **you are better people** than these fuckers with billions of dollars of AUM. You should be proud of yourselves as you are leading an unprecedented event in the history of finance. **Unprecedented.** This is why you should still guide others and be an example. Of course, we are not an entity and we will never be - just remember that you are a part of something great, maybe something that will change the way financial world operates, in a smaller or larger way. Remember that there are sharks among us who got pissed at the dirty games as well (shoutout to you Elon & Chamath). We are not alone.

They blame us? Let's blame them. They will lose all credibility sooner than later, not to mention this incoming generation. The media is here now, you still might convince my 80-year old grandpa that the internet is something out of Pandora's Box, but soon enough you won't be able to convince a single person. We are an important source of information for many people, and I'm not talking about WSB, but about the people that make it. Let's go there in the world and spread the facts.

Hence, dear Market Manipulators:

***Do not mislead again. Do not manipulate again. Get your facts straight. Retail matters, and you will see it.*** "
"It has been a. Pleasure to yolo with you gentlemen, Adult edition*",24093,a5a18z,https://i.redd.it/6qno5ezn9p321.jpg,2152,2018-12-11 22:26:40,
Meme Lord Elon,24085,b2jz2t,https://i.redd.it/i4qy3tlfawm21.jpg,323,2019-03-18 19:21:59,
Billionaire MLB owner Steven Cohen defiant after GameStop loss and says he’s ‘trying to make a living’,24083,l8mfqs,https://finance.yahoo.com/news/billionaire-mlb-owner-steven-cohen-210726997.html,2142,2021-01-30 17:08:56,
This is personal. For all of us.,24043,l5krk7,https://www.reddit.com/r/wallstreetbets/comments/l5krk7/this_is_personal_for_all_of_us/,1721,2021-01-26 21:56:54,"I've never seen anything like what's happening with $GME before, and I don't think I'll ever see anything like this.

This is a big moment. A tug of war between tradition and the future.

Hedge fund managers live in the past, and continue to look down upon the retail investors. They truly believe that we, the average retail investors, don't know anything about finances or the market (which may be true), and we're just gambling our money away.

We don't know any better. WE NEED HEDGE FUND MANAGERS TO TELL US WHAT TO DO! SAVE US!

This is the world they want to live in. This was the past.

Remember that scene from the Sopranos, where Tony's wife calls to buy 5000 shares of Webonics, after she was manipulated emotionally to so?  Institutions and hedge funds want us to be stuck in that world.

They're scared of the future.

They're scared because, so much information is available for free now. THere's no more fees for trading. We have large communities that discuss stocks and trading openly.

We can think and make decisions for ourselves, which scares the FUCK out of old school institutions and hedge funds.

Fuck them all. This affects every single one of you, whether or not you're holding $GME.

TLDR: Fuck hedge funds. This is a crosspoint into the future.  


EDIT: STOP GIVING ME AWARDS! GO SPEND THAT ON GME!! THIS IS NOT FUCKING FINANCIAL ADVICE AAAAHHH. Thanks."
Stonks 📈,23983,jojss7,https://v.redd.it/zyr9qp54nfx51,478,2020-11-05 17:35:47,
GME I will hold all my shares forever. Citadel reloaded. PROUD RETARD.,23918,l78skt,https://i.redd.it/kxaqbwb815e61.jpg,372,2021-01-29 00:04:34,
Made a LED GME ticker with live updates,23859,laxh1q,https://i.redd.it/eh5s36cvw2f61.jpg,389,2021-02-02 18:00:45,
People will try to gaslight you into believing that playing $GME is wrong or something to be ashamed of. But keep the following in mind...,23857,l6eqqu,https://www.reddit.com/r/wallstreetbets/comments/l6eqqu/people_will_try_to_gaslight_you_into_believing/,950,2021-01-28 00:25:53,"Inevitably, there will be a smear campaign led by certain organizations and media members against retail traders who are getting in on $GME. One argument that will be made is that it's not fair that we made so much money by recognizing that a group of hedge funds and institutions were in over their heads. It hurts the market and we should feel bad for exploiting them.

The total market cap of $GME is around $12B as I'm writing this. **The total market cap of Wall Street is around $50T.** That means we've currently displaced about .025% of the total value of the US stock market. I will type that out to reiterate: we (retail traders) have displaced approximately one quarter of one tenth of one percent of the total market cap. To claim that we are doing anything which is tremendously harmful to the whole market is absolutely pants-on-fire lies. Is this going to change some elements of the market moving into the future? Almost certainly. But even if this stock goes to $1000 per share, we are still only talking about less than one tenth of one percent of the total market cap that's out there. 

If you're looking at your RH balance right now  and thinking ""wow, that's a lot of money, am I doing something wrong? Illegal, even?"" the answer is **ABSOLUTELY NOT.** What you are beginning to notice is that the wealth gap in this country is absolutely massive. Thousands upon thousands of people could make year changing or life changing money out of this squeeze and it'll hardly be a blip on Wall Street's radar. Greed is absolutely out of control at the top and this funny little news story is tangible proof of that. Do not let them gaslight you into thinking that it's wrong for you to get a slightly larger sliver of the pie. 

Good luck to everyone playing this. I've got 100 shares at a cost basis of $103.95. I might not make millions, but I might be able to make a dent in my student loans, or pay off my car, or something that makes me just a little more hopeful that I'll be able to live some sort of ""American Dream"" before I'm old and wrinkled.

edit: and in the event that you're literally brand new to trading (we're getting a lot of new people here), I would highly encourage you to read up on investment basics (there are literally millions of resources on this) and do some research into $GME and why it's moving the way it is. I would not recommend taking a position on any stock if you can't articulate your own reason as to why you're invested in it."
Bezos tommorow morning,23853,gsopr1,https://i.redd.it/ktqamk6uvn151.png,413,2020-05-29 12:05:40,
"Japan still has your back - bought more GME at open, and now diamond hands till we land! I LOVE this stock!",23849,lbp20c,https://i.redd.it/k6t6f9p8z9f61.png,378,2021-02-03 17:46:31,
We're gunning for you r/askreddit,23818,g3nauz,https://i.redd.it/fcg3rnx8tkt41.png,1558,2020-04-18 17:12:59,
In Case There Was Any Doubt. Look At How Much The Hedge Funds Appreciate How Robinhood Fucked The Little Guys. $3.4bn In NEW Financing.,23816,lc3b9i,https://i.redd.it/abl4buxqzcf61.jpg,1104,2021-02-04 03:54:46,
The king,23763,jb85by,https://i.redd.it/pbzsxcg184t51.jpg,916,2020-10-14 23:54:10,
New dollar menu,23756,g501mc,https://i.redd.it/nmdsjrg841u41.jpg,372,2020-04-21 00:02:45,
They saved $6 Billion by halting trade yesterday,23751,l7u62v,https://i.redd.it/wjttb8h5aae61.jpg,624,2021-01-29 17:43:28,
“Everyone getting their fair share is just a bullshit concept”. Says it all.... True colours of these guys & their mentality.,23684,l7rm5s,https://i.redd.it/vgczgx8to9e61.jpg,662,2021-01-29 15:43:54,
