title,score,id,url,comms_num,created,body
Chamath Palihapitiya schools Scott Wapner on what the real issue is. CNBC didn't upload this on youtube!,53790,l6cjhx,https://www.youtube.com/watch?v=xVUBJSnBxKA,3379,2021-01-27 22:41:00,
We’re taking over Wall Street,53445,l9ht65,https://i.redd.it/wxu3ezjcjpe61.jpg,1091,2021-01-31 21:01:52,
Papa Elon back at it again with the one liners.,53385,l6zui9,https://i.redd.it/rl3ugvi7e3e61.jpg,766,2021-01-28 18:33:45,
"In just 2hrs, WSB have forced the Financial Times to adjust their article accusing our community of being linked to the alt-right. Hold the MSM to account and be excellent to each other.",53375,l6v1d4,https://i.redd.it/o0hpei8ic2e61.jpg,1743,2021-01-28 15:05:10,
"That's not very nice, Dr. Parik!",53085,lbnou7,https://i.redd.it/m5tdg17vm9f61.jpg,489,2021-02-03 16:38:51,
"If your friends and family are wondering why you're buying $GME @ $300, maybe you can explain it to them like this:",52980,l8lxuy,https://www.reddit.com/r/wallstreetbets/comments/l8lxuy/if_your_friends_and_family_are_wondering_why/,3280,2021-01-30 16:42:15,"There's a rich kid in town. Let's call him Melvin. He thinks he's really smart. He finds a coupon for $20 off the new Nintendo Switch during the holidays with no limit on number of units. This is easy. I'll go ahead and sell the Switch now for $200 and then buy it for $180 with the coupon. Easiest $20 I'll ever make. He goes and tells all his parents' friends at the Citadel Country Club that he can get them the new Nintendo Switch for their kids. He collects $200 each from 150 parents. He now has $30K and will use that money to purchase Nintendo Switches for $27K. He'll have earned $3K in just a few hours. His parents will be so proud.

There's another kid watching Melvin this entire time. Let's call him Keith. Keith doesn't like Melvin. Keith is good friends with the guys over at Gamestop. He finds out that there are were only 100 new Switches shipped to the entire country. Keith and his 99 friends buy all 100 Nintendo Switches on the spot.

Later in the day, Melvin goes to Gamestop with his $20 off coupon and says, ""I'll take 150 Nintendo Switches please."" Gamestop guy looks at him and says, ""Sorry, we're all sold out."" Melvin goes to the next Gamestop. Same story. All sold out. He goes to all the Gamestops in the city and can't find a single Switch. He won't be able to fulfill the orders.

Meanwhile, Keith is telling all his friends about what Melvin promised the members at the Country Club. Nobody sell him the Nintendo Switch that you bought, no matter how much he offers you. Nobody likes Melvin, so everybody holds on to their Nintendo Switch.

Melvin is in trouble. His parents rich friends are all asking when they are getting their Nintendo Switch. Melvins parents are angry, but they don't want to lose their standing in the Citadel Country Club. They have to help Melvin gets 150 Nintendo Switches. Now remember there are only 100 Switches in the city, but Melvin has created the expectation among the parents that there are 150. This is how you get a short percentage over 100%. Melvin has promised more than actually exist.

The price of Nintendo Switches in the city skyrockets. Melvins parents were able to get a few units from Keiths friends, but they had to pay really inflated prices for them, first $1,000, then $2,000, now $3,000. It's nearing Christmas, and every rich parent at the Country Club is desperate for the Nintendo Switch they promised their kids. They can't trust that Melvin will be able to get them one. They all start bidding against each other for Switches. Everybody in town is in on the action now. Everybody wants to get a Nintendo Switch to sell at the country club for $10,000. Meanwhile, Keith and his friends are just hanging out and playing Animal Crossing.

\[Edit 1: Thanks for all the love and awards. I'm really grateful. I'll try to answer as many question as I can on the thread and in the DM's\]

\[Edit 2: A few astute monkeys have pointed out some flaws in my story. The example above is an oversimplification and I left a few important elements. So here's an expanded version and I've had to adjust some of the numbers above to make room for new wrinkles.

In a more accurate version, Melvin went to his brother Steve's high school and borrowed 150 Nintendo Switches from the high schoolers. He tells them all that if he doesn't give them back within 24 hours, he will give them each $5 per day. The high schoolers know that it's not likely that Melvin will give it back in 24 hours, so they will be perfectly happy to collect $5 per day. He sells the 150 Switches to the Country Club parents for $200 each, but now he owes 150 Switches to the high schoolers. This is a naked short. He sold Switches that were borrowed but didn't own. Let's assume the Country Club parents wrapped the Switches and they are now under the tree and out of circulation. Although there are 250 Switches in the city, there are now only 100 Switches in circulation (Keith's friends). So you have a situation where Melvin owes 150 Switches to high schoolers and there are only 100 available (150% short position of float). Melvin is overconfident and thinks he will get 150 Switches same day or at the very worse case, the day after, and maybe have to pay 150 Switches x $5 penalty = $450. He'll still have made $3,000-$450 = $2,550. The $5 penalty due to the high schoolers is interest or Melvin's carrying costs, so the longer Melvin cannot get the Switches, the more expensive it's going to be for him. After 4 days, he's at break even and will lose $450 for each day he cannot get a Switch. It gets very expensive for Melvin and his parents very quickly. This is what's happening for the past week or so for GME. The hedge funds are bleeding money every day they cannot fulfill the IOU.

For those who are asking why Melvin doesn't just pay off the high schoolers with money, let's say that the new Zelda game is coming out and they all want to play. They also know that the price of Switches is rising. Even if Melvin offered $800 or $1,000 to cancel the IOU, they know that they can no longer get a Switch on the open market. In addition, the high schoolers are probably aware of the rising trend in Switch prices. They may think that it's better to wait for a Switch that will be worth $15,000 in a few days than to get paid off by Steve now for $1,000. So while it's possible that Melvin could buy his way out of it, it's very difficult.\]"
"I know y’all are used to seeing millionaires on here, but the little guys are also holding 💯🚀",52900,l9l2en,https://i.redd.it/j0syjjgp7qe61.png,3694,2021-01-31 23:23:31,
"Been an AMC employee for 5+ years, so thanks for bailing us out and saving my job. Also, ""I'm not fucking leaving""💎👐",52899,lae3zr,https://i.redd.it/g7eeiqkzkxe61.png,1179,2021-02-02 00:05:11,
Type yy into google.,52804,c75d5x,https://www.reddit.com/r/wallstreetbets/comments/c75d5x/type_yy_into_google/,17028,2019-06-30 02:14:57,That’s all I’m saying.
sounds right,52339,kprwen,https://i.redd.it/hf64odscc6961.png,1052,2021-01-03 23:08:21,
Please give the RIGHT Robinhood hate! This is a charity guys!,52129,l751qz,https://i.redd.it/vykx76n4d4e61.jpg,625,2021-01-28 21:50:06,
"I said if SPY closed green today, I would drink my pee. Here is my lame video.",52035,gak2gf,https://v.redd.it/wu2mkr3e8uv41,3218,2020-04-30 03:12:33,
"Coming soon to I-95 around Baltimore,MD",51875,l8ynh1,https://i.redd.it/uaays27vzje61.jpg,1319,2021-01-31 02:23:39,
"Down $1.1 Million over the week, and I Didn’t Hear No Bell 💎 👊 🦍",51739,lb6w36,https://i.redd.it/tvj6maumt4f61.jpg,1899,2021-02-03 00:26:07,
The moon has been reached. Next stop: MARS! 🚀🚀🚀🚀🚀🚀🚀💎🙌 See ya on Monday!,51670,l9mo6a,https://v.redd.it/x961o3qglqe61,1283,2021-02-01 00:36:42,
BREAKING: SEC issues ruling on GameStop stock trading,51634,l9415s,https://v.redd.it/z260t05ldle61,1132,2021-01-31 07:03:00,
We will win (Watch till end),51538,l7ajib,https://v.redd.it/cetvvggad5e61,1464,2021-01-29 01:12:34,
Paper hand bitch lol,51419,laycdy,https://i.redd.it/80phg5u133f61.jpg,3172,2021-02-02 18:35:19,
When you read fake news on CNBC that Melvin supposedly closed out,51022,l62vwm,https://i.redd.it/dwvbjs155vd61.jpg,1173,2021-01-27 14:50:17,
THE DIP IS FAKE. LOOK AT HOW MANY PEOPLE ARE BUYING COMPARED TO SELLING. RELAX AND HOLD,50859,lay22q,https://i.redd.it/6xpvizrx03f61.png,2465,2021-02-02 18:23:42,
One among us!,50719,kqy5e4,https://i.redd.it/tam67g44ji961.jpg,335,2021-01-05 16:07:18,
Robinhood is toast....Fidelity massive transfer volume,50674,l9of92,https://www.reddit.com/r/wallstreetbets/comments/l9of92/robinhood_is_toastfidelity_massive_transfer_volume/,3728,2021-02-01 01:59:09,"For what it's worth...

This morning I called up Fidelity because I wanted to make sure my extended hours trading was enabled on my account...took 90 minutes on hold to get through.  Apparently, they are slammed over at Fidelity, I asked the gal on the phone what's it been like today...she said because of all this stuff with Robinhood, they're looking at +700% daily volume for transferring accounts, which is quite amazing.

Happy hunting! 

WE LIKE THE STOCK!

STICK IT TO THE MAN!"
GME YOLO update — Jan 13 2021,50594,kwpviw,https://i.redd.it/1hw6ljgfz5b61.png,3208,2021-01-14 00:04:19,
Volume is low. Don’t believe the news. No one is selling. $GME is going to the moon. Hold on.,50519,labvei,https://i.redd.it/q3xpvdnn4xe61.jpg,2616,2021-02-01 22:34:39,
Mother of God - Ted Cruz and AOC agree on something and it's in defense of us idiots. We're uniting the country!,50479,l728vu,https://i.redd.it/tw56hgr6t3e61.png,1161,2021-01-28 19:58:10,
What in the world is Wallstreetbets?,50433,l8694g,https://www.reddit.com/r/wallstreetbets/comments/l8694g/what_in_the_world_is_wallstreetbets/,15412,2021-01-30 01:29:17,"Over the past few days, this subreddit has seen an absolutely insane amount of growth. In the past week, subscribers have quadrupled, pageviews have surpassed 1 BILLION, and the potential financial gains are unlimited!

We wanted to take a moment and teach all the newcomers what wallstreetbets is all about.

Wallstreetbets is a place of high risk, high reward, trades. Some are well thought out... but not usually.

#**We've got [losses](https://www.reddit.com/r/wallstreetbets/search?q=flair%3ALoss&restrict_sr=on&include_over_18=on&sort=top&t=all)!**

There was the guy who [bought gourd futures and lost everything](https://www.reddit.com/r/wallstreetbets/comments/kzoh1c/i_am_financially_ruined_agricultural_futures/), the guy who [turned a $5,000 investment into a $58,000 loss](https://www.reddit.com/r/wallstreetbets/comments/aeqcvt/i_dont_know_when_to_stop/), the guy who [put everything on the Argentinian peso, hours before it collapsed](https://old.reddit.com/r/wallstreetbets/comments/cpcao5/the_guy_that_called_argentina_to_tank_was_right/eworkdq/), the guy who [had to take physical delivery of oil](https://www.reddit.com/r/wallstreetbets/comments/g5e3e5/i_bought_oil_at_32_yesterday_and_made_26000_sort/?utm_source=reddit&utm_medium=usertext&utm_name=wallstreetbets&utm_content=t1_glamjdk) and [""GUH"" which is a video you just need to watch](https://www.reddit.com/r/wallstreetbets/comments/dpnzup/i_recorded_todays_marketopen_and_the_instant/). You can check out some more of [those losses here](https://www.reddit.com/r/wallstreetbets/search?q=flair%3ALoss&restrict_sr=on&include_over_18=on&sort=top&t=all).

#**We've got [gains](https://www.reddit.com/r/wallstreetbets/search?q=flair%3AGain&restrict_sr=on&include_over_18=on&sort=top&t=all)!**

Like resident GameStop multimillionaires u/deepfuckingvalue, we had the guy [who accidentally made $110K](https://www.reddit.com/r/wallstreetbets/comments/7w6cq0/i_somehow_made_110k_this_morning_and_im_still_not?utm_source=reddit&utm_medium=usertext&utm_name=wallstreetbets&utm_content=t1_glamo3x), there's the guy who [shorted the powerball lottery](https://www.reddit.com/r/wallstreetbets/comments/3zvxp5/shorting_powerball_update/) You can check out some more of [those gains here](https://www.reddit.com/r/wallstreetbets/search?q=flair%3AGain&restrict_sr=on&include_over_18=on&sort=top&t=all).

#**We've got general craziness!**

Like when [we found the ""infinite money cheat code"" on reddit](https://www.reddit.com/r/wallstreetbets/comments/drt5tr/guh_of_fame_2019/), forcing [Robinhood to post to WSB](https://www.reddit.com/r/wallstreetbets/comments/e4r0sy/robinhood_statement_on_options_collateral_and/) and push an update disabling options, we had [the CEO of Turing Pharmaceuticals, Martin Shkreli](https://www.reddit.com/r/IAmA/comments/3q38qg/iama_martin_shkreli_ceo_of_turing_pharmaceuticals/), regularly posting, livestreaming, and even becoming a moderator. We've got [Mr. Beast investing $100,000 in whatever the top comment said to invest in](https://www.reddit.com/r/wallstreetbets/comments/hrorfa/i_will_invest_100000_into_whatever_is_the_top/). We've got [Pokimane, asking what to invest in and becoming a moderator](https://www.reddit.com/r/wallstreetbets/comments/f75eod/thank_you_for_giving_me_moderator/) and subsequently crashing the market in March. We have people who lost bets and had to [drink their pee](https://www.reddit.com/r/wallstreetbets/comments/gak2gf/i_said_if_spy_closed_green_today_i_would_drink_my/) and [tattoo our logo on their butt](https://www.reddit.com/r/wallstreetbets/comments/io8i5z/im_back_bitches/) (NSFW).

---
---

So if you have an insane trade idea, **post it here**! We look forward to roasting you like we did u/deepfuckingvalue when he posted about GameStop in 2019. He's worth 8 (9?) figures now, so who knows, maybe you'll be next?

What you won't find here are political discussions, self-promotion, and other nastiness is not related to our single and most important goal: making money. 

For those new to the subreddit, you'll notice that we use [some ""colorful"" language](https://www.reddit.com/r/wallstreetbets/comments/l7fr21/basic_guide_to_wallstreetbets_culture_for). Rest assured, we mean you no harm. It might take a while to get used to how we talk, but you'll quickly find that this subreddit is surprisingly kind.

#**And we've got you!**

The community here is incredible. Each and every one of you make this place great and better than it was the day before. 

For those who have been around for a while, please reach out and help the newcomers. For those who are new, please don't hesitate to ask questions and get involved. 

From the bottom of my heart, thank you for being here.

---

---

#EDIT: BASED ADMINS MADE US A [WSB SNOOVATAR WITH DIAMOND HANDS](https://i.imgur.com/1xn0KqD.png)

Get it here: https://www.reddit.com/avatar"
The Financial Times are attempting to link WSB with the alt-right. Do not let the mainstream media villainise our community and push this narrative.,50388,l6s9tb,https://i.redd.it/nvp1vde7g1e61.jpg,3619,2021-01-28 12:01:23,
"We now have more degenerates than the population of New York City. YES, WE ARE BIGGER THAN THE MOST POPULOUS CITY IN THE UNITED STATES OF AMERICA. APES. TOGETHER. STRONG. 🦍🦍🦍💪💎💎💎🙌🚀🚀🚀🚀🚀",50380,lc06zu,https://i.redd.it/3tgtrc2m9cf61.jpg,1476,2021-02-04 01:28:32,
This is MARKET MANIPULATION. Where is the SEC on this???,50321,l6w6pl,https://i.redd.it/275nkyfno2e61.jpg,1626,2021-01-28 16:10:29,
Why should any American company ever act responsibly again?,49986,fxw3uz,https://www.reddit.com/r/wallstreetbets/comments/fxw3uz/why_should_any_american_company_ever_act/,2883,2020-04-09 21:00:59,"Whats the point of good corporate governance and fiscal responsibility? The companies that leveraged themselves to the moon, did stock buybacks to hyper-inflate their stock price, live on constant debt instead of good balance sheets are now being bailed out by unlimited QE. Free money to cover your mistakes. Why would anyone run a good business ever again? Just cheat and scheme and get bailed out later.

Edit: I am truly honored to be the number 1 post on WSB. To get validation from you autists and retards, the greatest American generation, is the peak moment of my life. Thank you all.

Edit 2: Many of you are saying this post is socialist. It is anti-capitalist. It is anti-wall street. It is none of that. My post is in fact about fixing capitalism so it is done the right way. Don't reward companies that are managed poorly and don't invest their profits wisely. Capitalism is about survival of the fittest and rewarding the winners not the schemers and cheaters. I'd rather have a profitable company that pays its workers livable wages, doesn't use sweat shop labor, doesn't pollute our environment, gives good quality healthcare, paid family leave, sick leave, maternity/paternity leave, reinvests in improving infrastructure, keeps low debt to equity, and has a 12 month emergency fund for a black swan event. Not companies that give all the money to the CEO and Board and nothing to the workers, do stock buy-backs with profits instead of improving infrastructure or saving for emergency funds. Let the greedy poorly run companies fail so we can invest only in good quality companies that treat their workers well. We will all make tons of profits in the market with well run companies and main street America will also be able to live a decent quality life. 

Edit 3: I am not a salty bear. In fact I want the market to do well. But this is not the way. Bailing out weak companies that didn't save for a black swan event because of CEO greed is just making this bubble bigger and bigger and it will only pop worse later on. JPow will ruin our market and the economy with this fake bubble with his printer. Let the market be free so we can shed weak companies and true capitalism can see a rise of the strong companies and the market can moon again.

JPow and his printer are really helping the Wall street elite. Jpow doesn't care about you. Now the tax payers are bailing out shadow banking. Junk bonds are risky loans that private equity, hedge funds, and other shadow banking institutions give out to desperate companies that can't get loans from regular banks anymore. That's why junk bonds are shadow banking instead of traditional banking. JPow is using his unlimited printer to BAILOUT and give free money to the shadiest and greediest characters of wall street and society in general - private equity, hedge fund managers, shady billionaires.

PE, hedgies, shady billionaires were screwed because the economy just halted and companies were going to default on these risky loans since they had no revenue coming in. This is who JPow is helping. He just bailed them all out by buying these risky junk bonds on the back of the American tax payer. You may become homeless and starve, but private equity, hedge fund managers, and shady billionaires will be made whole by the fed."
Soon we'll all be able to buy our own GameStop 🚀🚀🚀,49821,l8e3t6,https://i.redd.it/2yvxh1ssgee61.png,1117,2021-01-30 07:47:54,
Oil is now expenzive,49779,d51f4o,https://i.redd.it/2j386s5iuym31.png,1004,2019-09-16 18:28:12,
THEY ARE LYING STRAIGHT TO OUR FACE. DON’T BELIEVE THIS GARBAGE.,49161,la6mfs,https://i.redd.it/ib5bta2r3we61.jpg,1103,2021-02-01 19:06:50,
DONT FALL FOR THE FAKE BS REPORT BY CNBC,49045,l62ue5,https://www.reddit.com/r/wallstreetbets/comments/l62ue5/dont_fall_for_the_fake_bs_report_by_cnbc/,2647,2021-01-27 14:47:20,"Melvin capital have not closed their positions!! The volume is too low for it to be even possible. The short interest has not changed! 

The squeeze has not been squoze.

FUCK YOU MELVIN AND FUCK YOU CITRON. WERE COMING AFTER YOUR SHORTS🚀🚀🚀

BUY THE DIP AND HOLD 🚀 WERE HITTING 1000 FRIDAY 

I LIKE THIS STOCK I WILL BUY MORE"
420.69 at premarket - sign from the Stonk Gods,48977,l7oobr,https://i.redd.it/1y9jfxuht8e61.jpg,1570,2021-01-29 12:48:19,
"My dad, working through a 15-hour time zone difference almost every day",48730,d29nov,https://i.redd.it/60asaz4zhsl31.jpg,1618,2019-09-10 20:02:17,
Guys I’m sorry I panicked and bought more🚀🚀🚀🚀🚀🚀💎🙌🏽💎🙌🏽,48656,layjrn,https://i.redd.it/jxc5qhnj43f61.jpg,1286,2021-02-02 18:43:43,
u/Thechalkingdad with is chalk art,48485,l9ozuk,https://i.redd.it/vfkd0oub5re61.jpg,427,2021-02-01 02:26:46,
I see dead hedge funds,47893,l6l6b2,https://v.redd.it/o1wnj9y3ezd61,690,2021-01-28 05:06:36,
My wife just told me she's pregnant with our 2nd!! 🥳 A) sweet! B) THANK YOU WSB FOR THESE 3M RETURNS! I'm on track to retire early and spend time with my kids 🙂🥲😭,47832,ldn46e,https://i.redd.it/jktm9ngjjrf61.jpg,2111,2021-02-06 04:50:31,
She belongs here,47627,k3n4dx,https://i.redd.it/yfgbxo8mia261.jpg,1040,2020-11-30 05:41:19,
I hope as a community we can respect /u/DeepFuckingValue's decision if/when he decides to sell $GME and not flip out on a guy who's never once said he's planning to hold till the end of time.,47545,lald38,https://www.reddit.com/r/wallstreetbets/comments/lald38/i_hope_as_a_community_we_can_respect/,1917,2021-02-02 05:36:56,"I feel like with /u/deepfuckingvalue being positioned as the figurehead of the $GME movement and the 'if he is still in I'm still in' crowd that some people may feel betrayed if he decided to sell his whole position and take profits.

Just remember that when DFV was buying $GME at prices as low as $4 per share he wasn't signing up for the 'diamond hands never sell' club and he never got into the play for reasons like smashing hedge funds, curing cancer etc. That stuff has all come about from us and people jumping on the bandwagon.

WSB before this crazy week that has changed the sub forever was all about taking on risk to try and make money fast. DFV has achieved that on a scale we haven't seen before and if he decides to take profits we should support him doing so and not get upset that it may affect the price etc or say he betrayed a cause he never signed up for.

If you've watched the guys youtube you will know he's an extremely nice and likeable guy, would hate to see people calling him judas or whatever if he decides to sell."
SHARE AND UPVOTE. Screw Wall Street. We need to make our trading platform for retail traders only.,47223,l71kd0,https://i.redd.it/1n1arg8sm3e61.png,1879,2021-01-28 19:34:56,
I’m doing my part!,47004,l92ydj,https://i.redd.it/rllqsca93le61.jpg,1571,2021-01-31 06:04:31,
Here it is in all its glory,46910,l8hfhy,https://i.redd.it/zi7yru37lfe61.jpg,1238,2021-01-30 11:34:19,
Putshire Cashaway,46621,g18kt2,https://v.redd.it/8teen7747ts41,942,2020-04-14 20:21:08,
We cant let WSB get political no matter what,46617,l7ixaz,https://www.reddit.com/r/wallstreetbets/comments/l7ixaz/we_cant_let_wsb_get_political_no_matter_what/,2528,2021-01-29 07:16:46,"I know everyone is excited about all the attention and likes having politicians sucking up to us. Claiming that they're going to go after any collusion. It's all bullshit. Its bullshit from the left and its bullshit from the right. They just want to tear into this issue because it's the classic underdog story and Americans love an underdog story more than anything. 

Right now WSB is like Rocky and every politician out there wants to line up to be in a selfie with Rocky. They're just using us for exposure especially to a crowd that they see as untapped.

Please dont let this place turn into a constant circle jerk of politics. Basically all of reddit is just political propaganda 24/7. This was the last good place on the internet. The LAST. It was the last actually funny place too. Once in awhile it even had incredible ideas.

 It's about to be co-opted by politics activists online claiming they care about ""this issue"". Then they're going to stick around and sometimes subtly and most of the time forcefully turn it into another propaganda machine.
It just makes me sick because I already know its over. I dont want it to be but this place is going to be filled with propaganda and nothing else almost 100% after GME is over. I'll miss you guys and all the great times and sarcasm. This place was the funniest place on the internet. 

If you feel how I feel do your best to keep people from pushing agendas. Agendas from either side but let's be frank this is reddit. We all know where this crap is heading.

My positions are 80k in PLTR options mostly expiring next year/2023 and 40k PLTR stock.

Edit: Obviously none of this was financial advice anyway but seriously NONE of this is financial advice I'm just a retard on the internet and if you listen to me for it maybe you're also retarded

Edit 2: 🚀🚀🚀🚀🚀🚀"
Still virgin but rich,46576,l8509l,https://i.redd.it/utovuhqzbce61.jpg,558,2021-01-30 00:37:21,
"UK Trading app FreeTrade are being forced to disable buys again citing orders from their FX provider. This is it folks, this is manipulation.",46059,l7u0im,https://i.redd.it/5vyvco1r8ae61.jpg,1999,2021-01-29 17:36:31,
