title,score,id,url,comms_num,created,body
Times Square right now,373817,l8rf4k,https://v.redd.it/x64z70f7eie61,11964,2021-01-30 21:00:38,
UPVOTE so everyone sees we got SUPPORT,301656,l6wu59,https://i.redd.it/sgoqy8nyt2e61.png,12775,2021-01-28 16:40:34,
GME YOLO update — Jan 28 2021,269146,l78uct,https://i.redd.it/opzucppb15e61.png,24104,2021-01-29 00:06:23,
GME YOLO month-end update — Jan 2021,242954,l846a1,https://i.redd.it/r557em3t5ce61.png,20929,2021-01-30 00:04:45,
"CLASS ACTION AGAINST ROBINHOOD. Allowing people to only sell is the definition of market manipulation. A class action must be started, Robinhood has made plenty of money off selling info about our trades to the hedge funds to be able to pay out a little for causing people to loose money now",217727,l6x130,https://www.reddit.com/r/wallstreetbets/comments/l6x130/class_action_against_robinhood_allowing_people_to/,18526,2021-01-28 16:49:11,"LEAVE ROBINHOOD. They dont deserve to make money off us after the millions they caused in losses. It might take a couple of days, but send Robinhood to the ground and GME to the moon."
It’s treason then,214764,l881ia,https://i.redd.it/d3t66lv1yce61.jpg,4695,2021-01-30 02:40:59,
"Used some of my GME tendies to buy Nintendo Switches from Gamestop, then donated them to a Children's Hospital. Got featured on the local news and brought glory to WSB.",207134,l8c0u4,https://www.nbcdfw.com/news/local/north-texas-investor-uses-gamestop-gains-help-sick-children/2537134/,7232,2021-01-30 05:53:40,
GME YOLO update — Jan 27 2021 --------------------------------------- guess i need 102 characters in title now,205119,l6ekdz,https://i.redd.it/a309gkm5yxd61.png,15470,2021-01-28 00:15:35,
IT'S POWER TO THE TRADERS NOW,205124,l7feld,https://v.redd.it/lu8aekujd6e61,5828,2021-01-29 04:35:58,
GME YOLO update — Feb 1 2021,204156,lae6j0,https://i.redd.it/og8ca1xskxe61.png,19062,2021-02-02 00:07:36,
Can we all take a moment and appreciate the Mods who have grinded through this and held our community together. Thank you.,193349,l6jobf,https://www.reddit.com/r/wallstreetbets/comments/l6jobf/can_we_all_take_a_moment_and_appreciate_the_mods/,7069,2021-01-28 03:57:32,
Wow super bowl commercial for us,189210,lexy8t,https://i.redd.it/tko5nh1qy4g61.jpg,3846,2021-02-08 01:58:50,
That’s what I thought,188520,l890i7,https://i.redd.it/f2yhugwt5de61.jpg,4720,2021-01-30 03:24:35,
I am proud to do my part in paying forward our good fortune with a donation of 6 Nintendo Switches and games to go with them to the Children’s Minnesota Hospital. Cant Stop. Won’t Stop. GameStop. (Still long 50 shares I WILL NOT SELL),183152,l90oq6,https://i.redd.it/sgrbt9vthke61.jpg,3895,2021-01-31 04:04:23,
"It runs very deep, my friends.",182369,l79x17,https://i.redd.it/b8zy92sy85e61.jpg,2897,2021-01-29 00:47:55,
Crazy mannnnnnn. We can't let this slide at all,179083,l74tr1,https://i.redd.it/8bels7zob4e61.jpg,2458,2021-01-28 21:42:01,
Drew this for you my fellow retards 💎🙌🏼,178511,l9kn3z,https://i.redd.it/h7sap8vb5qe61.jpg,3576,2021-01-31 23:04:58,
Mark Cuban spent nearly 2 hours answering questions in his AMA. And then immediately called into CNBC to defend WSB!,176619,lazmky,https://i.redd.it/5gwwn8rxb3f61.jpg,4472,2021-02-02 19:25:43,
AOC got our backs,176176,l6fg8q,https://i.redd.it/3v5c5quc5yd61.png,5506,2021-01-28 00:55:22,
I’m so proud of you all.,173367,l79jko,https://i.redd.it/ykiux57d65e61.jpg,2544,2021-01-29 00:33:21,
WE'RE IN THE ENDGAME NOW,171482,l7nces,https://v.redd.it/ilaw5wowd8e61,6676,2021-01-29 11:21:42,
WSB right now,168703,lb8jtk,https://i.redd.it/ptv7nhxy35f61.png,4254,2021-02-03 01:32:08,
In honor of finally seeing the almighty u/deepfuckingvalue. We must now do our part in having him written in the history books as the greatest that WallStreetBets has ever seen.,168213,l7z8pf,https://i.redd.it/2a8b56my8be61.jpg,3842,2021-01-29 20:58:34,
Congress might do something for once,166180,l7c6kb,https://i.redd.it/3lo7rt55p5e61.jpg,6907,2021-01-29 02:18:35,
"Not sure if anyone posted this here, but yikes",156792,l7bh1m,https://i.redd.it/76bcnhs2k5e61.jpg,5988,2021-01-29 01:50:11,
IMPORTANT!! THERE ARE NO SELLERS!!! DO NOT PANIC IF YOU SEE PRICE DROP HOLD THE LINE! UPVOTE SO PEOPLE DON’T PANIC.,156578,l70b59,https://i.redd.it/j6g1paf4h3e61.jpg,5194,2021-01-28 18:50:05,
"Hey everyone, Its Mark Cuban. Jumping on to do an AMA.... so Ask Me Anything",155641,lawubt,https://www.reddit.com/r/wallstreetbets/comments/lawubt/hey_everyone_its_mark_cuban_jumping_on_to_do_an/,27383,2021-02-02 17:35:23,Lets Go !
Our favourite analyst. 🚀🚀🙌💎🌕,152428,l8tw56,https://i.redd.it/djm50uj2xie61.jpg,4247,2021-01-30 22:46:11,
Doing my part,152269,l78yde,https://i.redd.it/af2t6dp725e61.png,2920,2021-01-29 00:10:30,
In case you needed proof that there are imposters among us. A bot posting the same negative sentiment comment multiple times per minute 🌈🐻,150933,lafh4d,https://www.reddit.com/gallery/lafh4d,6076,2021-02-02 01:00:53,
Forever never dies 🥰,150023,l92fas,https://i.redd.it/nn96rnp6yke61.jpg,2912,2021-01-31 05:36:00,
GME YOLO update — Feb 2 2021,148771,lb6jld,https://i.redd.it/rr9n7obwq4f61.png,17912,2021-02-03 00:11:48,
Fake news 🤣,147125,la8n7o,https://i.redd.it/hqyf4qyxhwe61.jpg,6297,2021-02-01 20:26:40,
Mic drop,146713,l7aj2e,https://i.redd.it/ozzh6wv9d5e61.jpg,1890,2021-01-29 01:12:04,
"WSB PIONEER. FEARLESS BAG HOLDER. BETTER THAN DIAMOND HANDS. RICHER THAN YOUR WIFE’S BOYFRIEND’S UNCLE. YES, THIS IS NONE OTHER THAN DEEPFUCKINGVALUE HIMSELF.",145303,l7weuu,https://i.redd.it/qdi8ldgrpae61.jpg,6042,2021-01-29 19:10:59,
"WSB, WHAT IS YOUR STRATEGY? 💎✋🚀",144866,l7qwvo,https://v.redd.it/gu8zbgeyf9e61,5334,2021-01-29 15:04:34,
We are all the way up,143002,l7dg1g,https://v.redd.it/jj0wn3cfy5e61,2042,2021-01-29 03:10:53,
"An Open Letter to Melvin Capital, CNBC, Boomers, and WSB",142495,l6omry,https://www.reddit.com/r/wallstreetbets/comments/l6omry/an_open_letter_to_melvin_capital_cnbc_boomers_and/,7957,2021-01-28 08:06:14," **Mods do not delete, this is important to me, please read**

&#x200B;

I was in my early teens during the '08 crisis. I vividly remember the enormous repercussions that the reckless actions by those on Wall Street had in my personal life, and the lives of those close to me. I was fortunate - my parents were prudent and a little paranoid, and they had some food storage saved up. When that crisis hit our family, we were able to keep our little house, but we lived off of pancake mix, and powdered milk, and beans and rice for a year. Ever since then, my parents have kept a food storage, and they keep it updated and fresh.

Those close to me, my friends and extended family, were not nearly as fortunate. My aunt moved in with us and paid what little rent she could to my family while she tried to find any sort of work. Do you know what tomato soup made out of school cafeteria ketchup packets taste like? My friends got to find out. Almost a year after the crisis' low, my dad had stabilized our income stream and to help out others, he was hiring my friends' dads for odd house work. One of them built a new closet in our guest room. Another one did some landscaping in our backyard. I will forever be so proud of my parents, because in a time of need, even when I have no doubt money was still tight, they had the mindfulness and compassion to help out those who absolutely needed it.

To Melvin Capital: you stand for everything that I hated during that time. You're a firm who makes money off of exploiting a company and manipulating markets and media to your advantage. Your continued existence is a sharp reminder that the ones in charge of so much hardship during the '08 crisis were not punished. And your blatant disregard for the law, made obvious months ago through your (for the Melvin lawyers out there: alleged) illegal naked short selling and more recently your obscene market manipulation after hours shows that you haven't learned a single thing since '08. And why would you? Your ilk were bailed out and rewarded for terrible and illegal financial decisions that negatively changed the lives of millions. I bought shares a few days ago. I dumped my savings into GME, paid my rent for this month with my credit card, and dumped my rent money into more GME (which for the people here at WSB, I would not recommend). And I'm holding. This is personal for me, and millions of others. You can drop the price of GME after hours $120, I'm not going anywhere. You can pay for thousands of reddit bots, I'm holding. You can get every mainstream media outlet to demonize us, I don't care. I'm making this as painful as I can for you.

To CNBC: you must realize your short term gains through promoting institutions' agenda is just that - short term. Your staple audience will soon become too old to care, and the millions of us, not just at WSB but every person affected by the '08 crash that's now paying attention to GME, are going to remember how you stuck up for the firms that ruined so many of us, and tried to tear down the little guys. I know for sure I'll remember this. In response, here is a [list of CNBC sponsors and partners](https://www.cnbcevents.com/sponsors/). They include, but are not limited to, **IBM**, **Cisco**, **TMobile**, **JPMorgan**, **Oracle**, and **ZipRecruiter**. Their parent company is [NBCUniversal](https://en.wikipedia.org/wiki/NBCUniversal), owned by **Comcast** and **GE**.

To the boomers, and/or people close to that age, just now paying attention to these ""millennial blog posts"": you realize that, even if you weren't adversely effected by the '08 crash, your children and perhaps grandchildren most likely were? *We're not enemies, we're on the same side*. Stop listening to the media that's making us out to be market destroyers, and start rooting for us, because we have a once in a lifetime opportunity to punish the sort of people who caused so much pain and stress a decade ago, and we're taking that opportunity. Your children, your grandchildren, might have suffered as I described because of the institutions that we're fighting against. You really want to choose them, over your own family and friends? We're not asking you to risk your 401k or retirement fund on a single GME bet. We're just asking you to be understanding, supportive, and to not support the people that caused so much suffering a decade ago.

To WSB: you all are amazing. I imagine that I'm not the only one that this is personal for. I've read myself so many posts on what you guys went through during the '08 crash. Whether you're here for the gains, to stick it to the man as I am, or just to be part of a potentially market changing movement - thank you. Each and every one of you are the reason that we have this chance. I've never felt this optimistic about the future before. This is life changing amounts of money for so many of you, and to be part of a rare instance of a wealth distribution from the rich to the poor is just incredible. I love you all.

&#x200B;

&#x200B;

Note: I can't seem to get a hold of mods and they keep fucking removing the post. I have no idea how to get this to stick and its important to me that the people I'm addressing read it."
If I can hold at -$10MM then you can hold too. 💎🙌,142453,l70vmz,https://i.redd.it/e2ra46rsk3e61.jpg,7253,2021-01-28 19:11:24,
Robinhood will not let new options or shares be bought apparently. This is market manipulation lol,139014,l6w4uo,https://i.redd.it/vboawqu6o2e61.jpg,15788,2021-01-28 16:07:54,
Like this post if you are holding!!💎 The real squeeze is yet to happen🚀,138866,l71fl1,https://www.reddit.com/r/wallstreetbets/comments/l71fl1/like_this_post_if_you_are_holding_the_real/,7180,2021-01-28 19:30:30,"Buy more during dips if you can, but at least hold.

We just have to hold until they fold. Today's actions by several brokers just show how desperate the hedge funds are getting.

Hold with your immovable diamond hands for all that you hold dear and we will be breaking Wall Street **TOGETHER** while making gargantuan tendies in the end!

**WE LIKE THE STOCK.**

Comment with brokers that aren't corruptible and that we can move to fast!

**YOU CAN STILL BUY ON**  
**Fidelity** (10k instant deposit, accounts can be opened quickly)  
**Others:** Vanguard, Revolut, TastyWorks, Charles Schwab, TD Ameritrade, Webull, Degiro, Wells Fargo, M1, Public, etc.

*Edit*: It seems like TD Ameritrade, Webull, M1 Finance, and Public have removed their restrictions. Brokers are folding to the political support we are receiving.

[**http://isthesqueezesquoze.com/**](http://isthesqueezesquoze.com/)"
PREACH,137093,l6b69k,https://i.redd.it/5tcc1yym4xd61.jpg,2313,2021-01-27 21:29:26,
First of many lawsuits I hope 🤞🏻 out of this bullshit!!!! #DownWithTheHOOD,133986,l73giz,https://i.redd.it/082ihpop04e61.jpg,5312,2021-01-28 20:39:53,
GME YOLO update — Feb 3 2021 – heads up gonna back off the daily updates for now,132093,lbykxg,https://i.redd.it/93vf02k2wbf61.png,10134,2021-02-04 00:18:25,
GME YOLO update — Jan 26 2021,131840,l5nphz,https://i.redd.it/cltvfhzmrqd61.png,9822,2021-01-27 00:08:03,
"Billboard in Oklahoma City, OK! If someone can rent out a billboard for GME you can hold your shares!!! 💎 🖐!!!! (Left watermark for credit)",131790,l8hsjd,https://i.redd.it/05ow7o3dqfe61.jpg,3338,2021-01-30 12:03:15,
Billboard! Went full retard!🚀🚀 North of Dallas along super busy I-35,131450,lbb12w,https://i.redd.it/mykky4blq5f61.jpg,2395,2021-02-03 03:30:51,
Charles Payne gets it!,129443,l70rzy,https://i.redd.it/1uii0mb9k3e61.jpg,1041,2021-01-28 19:07:39,
"u/DeepFuckingValue is being asked to testify in the upcoming GameStop hearing. ""Diamond hands and tendies gonna enter the Congressional Record""",128733,lc1udz,https://i.redd.it/qtmt9ovgmcf61.png,5916,2021-02-04 02:43:48,
Honor to Diamond Hands.,128413,l81fgb,https://i.redd.it/xaaphlp7nbe61.png,2650,2021-01-29 22:20:06,
"Cool, but why would they bother telling us?",127748,l8xsfa,https://i.redd.it/d59d324psje61.jpg,8917,2021-01-31 01:43:28,
CNN BACK. OFF. This is a LIE. Literally a 5 second scroll of our board would inform this to be untrue. EDUCATE yourselves!!!!!,126854,la6e16,https://i.redd.it/fj495vh52we61.jpg,6207,2021-02-01 18:57:51,
"Listen, it’s easy",126123,ldnmj9,https://i.redd.it/87u6ut6horf61.jpg,3368,2021-02-06 05:18:11,
Welcome to the Endgame.,125492,l8mzow,https://v.redd.it/l1pa6yuvdhe61,5643,2021-01-30 17:38:11,
You know something is about to go down when most members of Congress are United over Wall Street trying to fuck us.,123085,l77lgx,https://i.redd.it/j62vcq6gt4e61.jpg,2836,2021-01-28 23:20:57,
Where do we go from here and who is going to step up to help us?,120466,l6j4r9,https://www.reddit.com/r/wallstreetbets/comments/l6j4r9/where_do_we_go_from_here_and_who_is_going_to_step/,28699,2021-01-28 03:36:02,"We have grown to the kind of size we only dreamed of in the time it takes to get a bad nights sleep. We've got so many comments and submissions that we can't possibly even read them all, let alone act on them as moderators. We wrote software to do most of the moderation for us but that software isn't allowed to read the Reddit new feed fast enough and submit responses, and the admins haven't given us special access despite asking for it.

We're suffering from success and our Discord was the first casualty. You know as well as I do that if you gather 250k people in one spot someone is going to say something that makes you look bad. That room was golden and the people that run it are awesome. We blocked all bad words with a bot, which should be enough, but apparently if someone can say a bad word with weird unicode icelandic characters and someone can screenshot it you don't get to hang out with your friends anymore. Discord did us dirty and **I am not impressed with them destroying our community** instead of stepping in with the wrench we may have needed to fix things, especially after we got over 1,000 server boosts. That is pretty unethical.

To add to this, people are co-opting our name on twitter. I won't mention their accounts, but lots of handles with ""wsb"" and ""wallstreetbets"" in them are pretending to speak for us. They're saying things that we don't agree with, driving traffic to derivative communities and shitty pixelated merch stores, and generally making it harder for us to define who we are. There's also too much political bullshit in a community that was never *ever* political. The only way I want to occupy Wall St is in a suit myself or rent-free in the mind of a blown up short.

~~That is why I'm throwing my support behind the Twitter handle in general. We need a way to PUBLICLY reach out to the staff of the infrastructure that is failing us so the world can see that we aren't doing anything wrong here if they don't respond. We need to be able to respond directly to a reporter that is lying to the world about our clubhouse. We can't be expected to meet any expectations when we aren't given the tools we need.~~

~~That's not to say I approve of every message or will even be in the loop for all of them, but it's clear to me we can't do nothing and we need a megaphone.~~

~~We'll do our best not to pretend to speak for you, but to try to speak with the volume our name now seems to command to get shit done for us.~~

EDIT: As of recent developments the aforementioned twitter handle is obviously not legit anymore. Phew."
Oops,119907,l6z1yp,https://i.redd.it/0gnr4u6193e61.png,1084,2021-01-28 18:06:40,
DFV,118715,l7sjdx,https://i.redd.it/bmq1qruyw9e61.jpg,1135,2021-01-29 16:29:38,
Just bought $1MM worth of $GME. My profits from years of trading. Let’s stick it to the HFs! 🦍 strong together. 💎 🙌,116543,la6w8q,https://i.redd.it/6htn6hnn5we61.jpg,5212,2021-02-01 19:17:28,
To the person that's the laughing stonk of their family.,115178,lerm8e,https://i.redd.it/lg01l0rph3g61.png,1353,2021-02-07 21:01:40,
"BREAKING: SEC reviewing recent trading volatility amid GameStop frenzy, vows to protect ‘retail investors’",115140,l7tu52,https://www.cnbc.com/2021/01/29/sec-reviewing-recent-trading-volatility-amid-gamestop-frenzy-vows-to-protect-retail-investors.html,6294,2021-01-29 17:28:52,
Pirates of the Wall-Streetibbean,115076,ldguhp,https://i.redd.it/dyhy7cdb1qf61.jpg,1361,2021-02-05 23:46:35,
💎🙌 Here is our DeepFuckingValue in WSB style - art by crossdogz 🚀🚀,114738,l9dgbo,https://i.redd.it/e5g9w4xnioe61.jpg,2456,2021-01-31 17:36:07,
"Huge shoutout to Kevin O'Leary: ""Definition of the market is speculation. If you are short you know run a new risk that these effective social media vigilantes are going to come after you and squeeze you and its good because it will make a lot of hedge funds think for a second time before shorting.""",114730,l89alf,https://i.redd.it/yfqegtw58de61.png,3437,2021-01-30 03:37:56,
"Good Morning to Everyone Except Robinhood, courtesy of @KasparCMS on Twitter",113328,l8rlea,https://v.redd.it/tzn8jw52fie61,1291,2021-01-30 21:07:36,
"Don’t listen to them, this is them trying to take focus away from GME",112174,la09rn,https://i.redd.it/btz2rpbegue61.jpg,5812,2021-02-01 13:34:07,
RASHIDA IS WITH US,112155,l6z3e5,https://i.redd.it/90zbvwzk93e61.png,3991,2021-01-28 18:08:02,
The Hero we need right now : FUCK ROBINHOOD!,111432,l6wr6s,https://i.redd.it/caa8mpqdt2e61.jpg,3600,2021-01-28 16:37:00,
"THIS GUY IS FLYING A BANNER SAYING ""SUCK MY NUTS ROBINHOOD""",111351,l8rlyx,https://www.reddit.com/gallery/l8rlyx,1882,2021-01-30 21:08:16,
DO NOT SELL! Robinhood has blocked the buying of more shares. If you try to sell you will get fucked because who are you going to sell it to if nobody can buy it? They are trying to make you flood the market with sales offers and bring the price down. Dont fall for it!,110015,l6wsib,https://www.reddit.com/r/wallstreetbets/comments/l6wsib/do_not_sell_robinhood_has_blocked_the_buying_of/,4160,2021-01-28 16:38:34,
"Give them nothing, but take from them everything",107994,l78duc,https://i.redd.it/ijenw1bmy4e61.jpg,2768,2021-01-28 23:49:55,
"You heard him, HOLD! We can take $11.2 BILLION more away from them. Keep those diamond hands and let's send this thing to Alpha Centauri 🚀🚀🚀",107662,l7zqdy,https://i.redd.it/28nwnyd6cbe61.jpg,5083,2021-01-29 21:16:36,
My 102 year old grandmother bought GME in August 1995 and held through all this time.,107662,lavgj3,https://i.redd.it/1gy6kn7jg2f61.jpg,3324,2021-02-02 16:29:24,
DIAMOND HANDS VS THE WORLD 💎🤝💎💎SEE YALL ON THE MOON 🚀🚀🚀🚀🚀🚀🚀,107208,lammkd,https://v.redd.it/8w0e23a5jze61,2115,2021-02-02 06:46:05,
Justin Sun (Asian billionaire) has our back and is joining in.,107159,l7q26x,https://i.redd.it/8olsjgun89e61.jpg,4203,2021-01-29 14:13:21,
CNBC now running Ads promoting that Melvin Capital closed their short positions on $GME,106002,l8539h,https://i.redd.it/8vxraurkcce61.png,7468,2021-01-30 00:40:43,
Never forget. Last year when this guy soldout the subreddit for personal gain now trying to take credit for your movement for the same reason. #cloutchaser,104643,l8pr1a,https://v.redd.it/y987vjwozhe61,5282,2021-01-30 19:50:00,
"Mark Cuban said ""once the brokerage stops restricting trades, then we'll see what WSB is really made of"". Well, guess what? Robinhood has removed all restrictions.",104497,lcyewd,https://www.reddit.com/r/wallstreetbets/comments/lcyewd/mark_cuban_said_once_the_brokerage_stops/,6159,2021-02-05 06:32:31,Let's show them what we're made of: retards.
Some dickhead on CNN said the government should ban people for talking about the stock market on the internet. This ain’t China bro,103219,l6e0kt,https://www.reddit.com/r/wallstreetbets/comments/l6e0kt/some_dickhead_on_cnn_said_the_government_should/,3733,2021-01-27 23:46:54,
DEEPFUCKINGVALUE just TWEETED! HOLD THE FUCKING LINE!!!!,102256,lbsbwu,https://www.reddit.com/gallery/lbsbwu,5364,2021-02-03 20:06:10,
Today wasn’t a bloodbath for $GME or $AMC. WE watched LITERAL insanity as Hedgies sat and traded their trash BACK and forth to each other in order to cause YOU to panic. HOLD. BUY.,101330,lajk83,https://www.reddit.com/r/wallstreetbets/comments/lajk83/today_wasnt_a_bloodbath_for_gme_or_amc_we_watched/,6109,2021-02-02 04:05:33,"DD I saw posted elsewhere: hedge funds are trying their hardest to short ladder $AMC and $GME. Just hold your stock, buy more if you can afford to! 

Check out real time trade stats by googling: ""Nasdaq AMC real time trades"" and you'll see all the trade orders are 100 share volumes every millisecond. 

These are desperate hedge funds trading their stocks back and forth for a lower and lower price, driving the price down. The price drop means absolutely nothing AS LONG AS EVERYONE IS HOLDING, this will explode!

The shirts tried their damndest to drive down the share prices of both $GME and $AMC today. Specifically look at $AMC. With all that volume traded you’d expect a shitload more movement. What they got was **resistance** You could see them continuing the ladder attack after hours when YOU can’t trade. On BOTH stocks. 

The way forward is to tell them to go fuck themselves and BUY that shit up tomorrow. Let them keep punting the football back and forth to one another all day. If they can double down and play the long game SO can we. 

This is not financial advice. I’m just a retard who REALLY likes these stocks.

Edit: **LOOK AT THIS SHIT LOL** https://twitter.com/beijing_bobby/status/1356377066988564486/photo/1

Edit 2: **IF YOU’RE WONDERING IF YOU ARE DOING THE RIGHT THING WITH $AMC EL PRES KNOWS AND IS STILL HOLDING.** 
https://twitter.com/Thowe51/status/1356320431142268928?s=20"
Who of my 300 brethren's are still in ?,100662,lbjgc6,https://i.redd.it/c2h5pujf88f61.png,14851,2021-02-03 11:54:46,
APES IN CONTROL,99636,lb20ea,https://i.redd.it/pzivdqp1t3f61.png,3189,2021-02-02 21:01:05,
"JOSH SHAPIRO, Attorney General of Pennsylvania, is showing his support on Twitter!!!! 🚀🚀",99595,l7b321,https://i.redd.it/3hbf2bqbh5e61.jpg,1085,2021-01-29 01:34:47,
Doing my part! Just bought a billboard to run all next week on I-35 between Austin and Dallas!,99271,l8ky8k,https://i.redd.it/grhwc24ttge61.png,3462,2021-01-30 15:44:20,
This is what holding the line looks like! Look at that volume. Diamond-Hands keep it up!,98304,laa0q9,https://i.redd.it/thafw05lrwe61.png,6479,2021-02-01 21:21:11,
Billionaire Investor Mark Cuban Says Reddit Stock Traders Have ‘Every Right To Kick Wall Street’s Ass’ - All Hail Wise Cuban Man!,98305,lab340,https://www.unilad.co.uk/news/billionaire-investor-mark-cuban-says-reddit-stock-traders-have-every-right-to-kick-wall-streets-ass/,1426,2021-02-01 22:03:19,
They act like silver is so fetch,98053,la3ku2,https://i.redd.it/g4yoioifgve61.gif,2700,2021-02-01 16:56:30,
CNBC Gives Billionaires A Pass But Calls For Regulation When The Little Guy Makes Money,97063,l68xm1,https://i.redd.it/lrxfqnreowd61.png,2725,2021-01-27 19:58:44,
Apparently it’s only ok when the 1% do it.,95679,l79p8w,https://i.redd.it/nu8a03pg75e61.jpg,1083,2021-01-29 00:39:30,
"HOORAY FOR CHARLES PAYNE! “The shorts have had their way with the market for decades, and no one has ever complained about it, so i am thrilled, that individual investors are playing the same game, and now you (big hedge funds) are losing” - Charles Payne.",95542,l6popa,https://i.redd.it/nhc2rhacl0e61.jpg,2100,2021-01-28 09:08:22,
WSB'S REVENGE - CALLING ALL 🦍🦍🦍 TO KEEP YOUR 🍌🍌🍌 AWAY FROM THE 🐍🐍🐍,95438,l6mwjk,https://v.redd.it/3s5ue35dtzd61,2602,2021-01-28 06:32:49,
"Congratulations, /r/wallstreetbets! You are Subreddit of the Day!",94468,l7sx8h,https://www.reddit.com/r/subredditoftheday/comments/l7swts/january_29th_2021_rwallstreetbets_to_the_moon/,1692,2021-01-29 16:47:54,
